Title,Link
Open new window to view Chapter 110 - Bylaw Enforcement ,https://lf.kitchener.ca/WebLinkExt/DocView.aspx?dbid=0&id=1789216
Open new window to view commercial kitchen regulations,https://lf.kitchener.ca/WebLinkExt/0/edoc/1997572/Commercial%20Kitchen.pdf
Open new window to view permanent vendor regulations,https://lf.kitchener.ca/WebLinkExt/0/edoc/1584703/Permanent%20Vendor.pdf?_ga=2.245909892.1689925153.1606064828-1723526567.1566582097
Open new window to view place of amusement regulations,https://lf.kitchener.ca/WebLinkExt/0/edoc/1584706/Place%20of%20Amusement.pdf?_ga=2.78661140.1689925153.1606064828-1723526567.1566582097
Open new window to view special event regulations,https://lf.kitchener.ca/WebLinkExt/0/edoc/1584710/Special%20Event.pdf?_ga=2.12649783.1689925153.1606064828-1723526567.1566582097
Open new window to view laundrette or dry cleaner regulations,https://lf.kitchener.ca/WebLinkExt/0/edoc/1584697/Laundrette.pdf?_ga=2.209348882.1689925153.1606064828-1723526567.1566582097
Open new window to view auctioneer regulations,https://lf.kitchener.ca/WebLinkExt/0/edoc/1584688/Auctioneer.pdf?_ga=2.242493058.1689925153.1606064828-1723526567.1566582097
Open new window to view building bylaw,https://lf.kitchener.ca/WebLinkExt/DocView.aspx?dbid=0&id=1745866&page=1&cr=1
Open new window to view theatre regulations,https://lf.kitchener.ca/WebLinkExt/0/edoc/1584713/Theatre.pdf?_ga=2.256124171.1689925153.1606064828-1723526567.1566582097
Open new window to view coop regulations,https://lf.kitchener.ca/WebLinkExt/0/doc/1497603/Page1.aspx
Open new window to view refreshment vehicle regulations,https://lf.kitchener.ca/WebLinkExt/0/edoc/1584709/Refreshment%20Vehicles.pdf?_ga=2.48844326.1689925153.1606064828-1723526567.1566582097
Open new window to view pet shop regulations,https://lf.kitchener.ca/WebLinkExt/0/edoc/1584705/Pet%20Shop.pdf?_ga=2.41053730.1689925153.1606064828-1723526567.1566582097
Open new window to view DSD-2021-42: New Zoning By-law (Stage 2a) – Residential Base Zones,https://lf.kitchener.ca/WebLinkExt/0/doc/1928995/Page1.aspx
Open new window to view DSD-19-272: New Zoning By-law (Stage 2a) – Deferred Item: RES-3 Lot Width,https://lf.kitchener.ca/WebLinkExt/0/doc/1803283/Page1.aspx
Open new window to view business licensing bylaws,https://lf.kitchener.ca/WebLinkExt/DocView.aspx?id=1789212&cr=1
Open new window to view property standards bylaw,https://lf.kitchener.ca/WebLinkExt/0/doc/1737934/Page1.aspx
Open new window to view DSD-19-233: New Zoning By-law (Stage 2a) – Residential Base Zones,https://lf.kitchener.ca/WebLinkExt/DocView.aspx?dbid=0&id=1791497&page=1&cr=1
Open new window to view Chapter 1000 - Schedule 'A' - Concordance of bylaws and Chapters,https://lf.kitchener.ca/WebLinkExt/DocView.aspx?dbid=0&id=1789296
Open new window to view contractors regulations,https://lf.kitchener.ca/WebLinkExt/0/edoc/1584691/Contractors.pdf?_ga=2.90768794.1689925153.1606064828-1723526567.1566582097
Open new window to view lodging house regulations,https://lf.kitchener.ca/WebLinkExt/0/doc/1412653/Page1.aspx?_ga=2.7556658.1689925153.1606064828-1723526567.1566582097
Open new window to view fence bylaw,https://lf.kitchener.ca/WeblinkExt/0/doc/1789214/Page1.aspx?_ga=2.190121387.1224078607.1614278180-459943238.1614278180
Open new window to view pet care establishment regulations,https://lf.kitchener.ca/WebLinkExt/0/edoc/1584704/Pet%20Care%20Establishment.pdf?_ga=2.245909892.1689925153.1606064828-1723526567.1566582097
Open new window to view street vendor regulations,https://lf.kitchener.ca/WebLinkExt/0/edoc/1584711/Street%20Vendor.pdf?_ga=2.15230518.1689925153.1606064828-1723526567.1566582097
Open new window to view old gold regulations,https://lf.kitchener.ca/WebLinkExt/0/edoc/1584702/Old%20Gold%20Shop.pdf?_ga=2.12084404.1689925153.1606064828-1723526567.1566582097
Open new window to view alternative massage centre regulations,https://lf.kitchener.ca/WebLinkExt/0/doc/1412640/Page1.aspx?_ga=2.11609396.1689925153.1606064828-1723526567.1566582097
Open new window to view buskers regulations,https://lf.kitchener.ca/WebLinkExt/0/edoc/1584690/Buskers.pdf?_ga=2.23162170.1689925153.1606064828-1723526567.1566582097
Open new window to view farmers' market regulations,https://lf.kitchener.ca/WebLinkExt/0/edoc/1997573/Farmers%20Market.pdf
Open new window to view procurement bylaw,https://lf.kitchener.ca/WebLinkExt/DocView.aspx?dbid=0&id=2019748&page=1&cr=1
Open new window to view mobile business regulations,https://lf.kitchener.ca/WebLinkExt/0/edoc/1584698/Mobile%20Business.pdf?_ga=2.7556658.1689925153.1606064828-1723526567.1566582097
Open new window to view temporary vendor regulations,https://lf.kitchener.ca/WebLinkExt/0/edoc/1584712/Temporary%20Vendor.pdf?_ga=2.256124171.1689925153.1606064828-1723526567.1566582097
Open new window to view beauty salon or barber shop regulations,https://lf.kitchener.ca/WebLinkExt/0/edoc/1584689/Beauty%20Salon.pdf?_ga=2.86073880.1689925153.1606064828-1723526567.1566582097
Open new window to view full noise bylaw,https://lf.kitchener.ca/WebLinkExt/0/doc/1412627/Page1.aspx
Open new window to view Chapter 1100 - Schedule 'A' - Concordance of bylaws and Chapters (sorted by chapter number) ,https://lf.kitchener.ca/WebLinkExt/DocView.aspx?dbid=0&id=1789220
Open new window to view convenience store regulations,https://lf.kitchener.ca/WebLinkExt/0/edoc/1584692/Convenience%20Store.pdf?_ga=2.87174424.1689925153.1606064828-1723526567.1566582097
Open new window to view driving school regulations,https://lf.kitchener.ca/WebLinkExt/0/edoc/1584693/Driving%20School.pdf?_ga=2.212363796.1689925153.1606064828-1723526567.1566582097
Open new window to view sign bylaw,https://lf.kitchener.ca/WebLinkExt/DocView.aspx?id=1412712&searchid=8b2c2649-bbd7-4153-b322-864bda544ea7&dbid=0
Open new window to view nightclub regulations,https://lf.kitchener.ca/WebLinkExt/0/edoc/1584701/Nightclub.pdf?_ga=2.20644280.1689925153.1606064828-1723526567.1566582097
Open new window to view food shop regulations,https://lf.kitchener.ca/WebLinkExt/0/edoc/1584695/Food%20Shop.pdf?_ga=2.46366119.1689925153.1606064828-1723526567.1566582097
Open new window to view City of Kitchener bylaw,https://lf.kitchener.ca/WebLinkExt/DocView.aspx?id=1988278&searchid=db9ed7af-b55f-4e03-8273-d0790942e1d3&dbid=0&cr=1
Open new window to view adult entertainment parlour regulations,https://lf.kitchener.ca/WebLinkExt/0/doc/1575974/Page1.aspx?_ga=2.11616564.1689925153.1606064828-1723526567.1566582097
Open new window to view public hall regulations,https://lf.kitchener.ca/WebLinkExt/0/edoc/1584708/Public%20Halls.pdf?_ga=2.48844326.1689925153.1606064828-1723526567.1566582097
Open new window to view pop-up shop regulations,https://lf.kitchener.ca/WebLinkExt/0/edoc/1584707/Pop-up%20Shop.pdf?_ga=2.78661140.1689925153.1606064828-1723526567.1566582097
Open new window to view food truck regulations,https://lf.kitchener.ca/WebLinkExt/0/edoc/1584696/Food%20Truck.pdf?_ga=2.46366119.1689925153.1606064828-1723526567.1566582097
Open new window to view our full animal bylaw,https://lf.kitchener.ca/WebLinkExt/DocView.aspx?dbid=0&id=1497603&_ga=2.130462543.1910271040.1506429937-429985511.1422993744
Open new window to view motor vehicle facility regulations,https://lf.kitchener.ca/WebLinkExt/0/edoc/1584700/Motor%20Vehicle%20Facility.pdf?_ga=2.255601928.1689925153.1606064828-1723526567.1566582097
